{
    "description": "Parameters to create a heatmap plot using the 'rugplot' R package",
    "filename": "./data/exergamelf.csv",
    "variables": null,
    "method": "raster",
    "aesthetics": {
        "y_variable": "myVars",
        "x_variable": "idrow",
        "fill": "value",
        "alpha": null,
        "group": null,
        "colour": null,
        "height": null,
        "linetype": null,
        "linewidth": null,
        "width": null
    },
    "position": "identity",
    "size": null,
    "interpolate": false,
    "alpha": null,
    "colour": null,
    "linetype": null,
    "linewidth": null,
    "facet_row": null,
    "facet_column": null,
    "labels": {
        "title": null,
        "subtitle": null,
        "tag": null,
        "x": null,
        "y": null,
        "colour": null,
        "fill": null,
        "caption": null
    },
    "theme": {
        "legend": {
            "key": {
                "size": null,
                "width": null,
                "height": null
            }
        }
    },
    "color_manual": {
        "values": null,
        "breaks": null,
        "labels": null
    },
    "rotxlabs": 0,
    "save": {
        "save": false,
        "outputfilename": null,
        "overwrite": false,
        "width": 15,
        "height": 10,
        "dpi": 72,
        "device": "pdf",
        "sanitize": true
    }
}

